content,uid,uname,addtime,likes
看过很多这种类型的电影，这些很多都是老演员了，演技在线，剧情也很紧凑，我觉得挺好挺有意思的啊[捂脸笑],349529710789253,ccccchooi,2023-12-21 22:23:34,117
我天，不愧都是老戏骨演的太好了，剧情节奏紧张，真的很好看，没看的赶紧看！,1794816517,大魔女宅,2023-12-21 22:04:57,66
大家好，我是演员任达华。由我监制并主演的的电影《零号追杀》正式上线了！不知道是谁说我老了？我只能说作为一名经验丰富的老牌特工，想当年我可是口藏刀片、横扫一片。而现在，我就算拿着肥皂也能制服你们。不信？就来电影里看看我吧！,1742117753,任达华,2023-07-21 09:42:43,4832
部分说看不好的估计是因为港片内采用了大量现代科技，思维还停留在老港片那种味道，这种新旧结合的方式以后慢慢会更多吧！ 警员手册最后一条是啥？,2424876606,傻傻傻鹤,2024-03-18 17:05:39,0
哎一古 真的很好看啊，专门开了个会员看的，没想到这么好看,4695563463417536,别说太多,2024-02-18 15:56:33,2
剧情还算不错，整体气氛都挺紧张的，特效跟动作这块也还可以，演技也都很到位，好歹也是老戏骨，基本上算的是一部很不错的国内片，值得一看。[666],2195260766,Roolove,2024-02-05 17:56:23,6
"大家好，我是演员安志杰。
由我主演的电影《零号追杀》上线啦。
我饰演的阿杰，是一个为达目的不罢休，但看到脸就能被原谅的角色。
穿上西装，拿上枪，特工老大我来当！
期待和大家在电影里“重拳”相见哦～",2660161579760257,安志杰Andy On,2023-07-21 09:43:31,1504
老港片的的感觉又回来了，算是很不错的动作片了，看得我相当过瘾,1845181157,啦啦啦啦一会,2024-03-11 10:37:58,1
这是电影，又不是实际，挺好看的啊，动作，剧情都很紧凑，也很连贯，没有让人迷惑的地方[大拇指]好看我觉得,349529710789253,ccccchooi,2023-12-21 22:25:38,13
剧情演员演技都非常在线，太精彩了，比现在那些无脑剧情情爱爱的好看太多了[大拇指],1446972392,豆子の,2023-12-19 17:30:15,15
