content,uid,uname,addtime,likes
《论没到12点直接上线的那件事》[捂脸笑],1642278262,超爱吃西餐的公山辰阳,2024-03-23 11:48:05,320
来啦 希望之后每周都提前播[色][色],2706671755451328,　xixicc,2024-03-23 11:51:07,174
这个时长太短了，只有60分钟[捂脸笑][捂脸笑][捂脸笑],985280366526329,特宠大哥哥伏特加,2024-03-23 12:31:18,126
太棒啦[应援][应援]终于来啦 最爱的综艺,645393599704910,超开心的小石12138,2024-03-23 11:55:25,89
拍的啥，一个斜坡拍了大半集，像极了我写作业水文字。,1266661117,布布超可爱呀,2024-03-23 14:03:54,57
我的电子榨菜又回来了[色],340969471879229,来一口小熊软糖么🍬,2024-03-23 12:00:54,70
#五哈老挝行名场面#就喜欢邓超带着小鹿和赤赤一起搞综艺,3302011932092928,和我产生共鳴🍓,2024-03-23 13:52:16,58
看的出来，超哥真的在慢慢变老，童年的回忆，希望超哥可以老的慢一点,4269905461509376,孤注一掷👿💤,2024-03-23 13:31:23,51
#五哈老挝行名场面#看超哥上斜坡这一段，真的就是非常让我们心疼了，并且也是非常好笑的，真的就是完全站不住,4605052195026944,公主统治世界👸,2024-03-23 13:58:09,38
开幕仪式有点简朴了，黑衣人一出来把他们几个吓得表情都变形了哈哈哈笑死我了，下饭神综艺，刚刚吃饭饭都笑喷了[呲牙][呲牙][呲牙]五哈还得是你[大拇指][大拇指],1600984987,我累了，没哭*,2024-03-23 12:33:00,36
